title,date
"Nigeria’s challenge is low revenue, not high debt – World Bank",No date
"INEC extends voter registration by 2 weeks, unveils full self-service option",No date
I never opposed Amaechi’s nomination – Kenneth Okonkwo,No date
Malami meets Amaechi in Abuja amid ADC political consultations,No date
Amaechi meets Tambuwal in Abuja amid 2027 ADC consultations,No date
"Court affirms Mark-led leadership of ADC, dismisses Abejide’s suit",No date
Lagos 2027: Rhodes-Vivour explains how he’ll contest without Obi’s influence,No date
Atiku appoints Kenneth Okonkwo as spokesperson,No date
Another batch of Nigerians evacuated from South Africa arrives Lagos,No date